{
  "schema_version": "1.0",
  "phase": "build",
  "started_at": "2026-06-11T09:00:00-04:00",
  "ticket": "OBS-3",
  "previous": [
    {
      "phase": "cowork",
      "started_at": "2026-06-10T14:00:00-04:00",
      "ended_at": "2026-06-11T09:00:00-04:00",
      "ticket": "OBS-1"
    },
    {
      "phase": "plan",
      "started_at": "2026-06-09T20:00:00-04:00",
      "ended_at": "2026-06-10T14:00:00-04:00",
      "ticket": null
    }
  ],
  "notes": "Currently building OBS-3: Dataview portfolio query in 00-PORTFOLIO.md"
}
